{
  "about": {
    "author_name": "xurei",
    "author_url": "http://about.xurei.io"
  },
  "label": "Rainbow",
  "revision": 1,
  "steps": 1,
  "input_time": true,
  "parameters": [
    {
      "name": "mode",
      "label": "Rainbow Mode",
      "type": "list_int",
      "values": [
        {"label": "Linear", "value": 0},
        {"label": "Random", "value": 1}
      ],
      "default": 0
    },
    {
      "name": "time",
      "label": "time",
      "type": "time"
    }
  ]
}
