{
  "about": {
    "author_name": "xurei",
    "author_url": "http://about.xurei.io"
  },
  "metafileVersion": 1,
  "label": "AAA Transparency test",
  "revision": 1,
  "steps": 1,
  "parameters": [
    {
      "name": "green_channel",
      "label": "green_channel",
      "type": "float",
      "slider": true,
      "min": 0.0,
      "max": 1.0,
      "step": 0.01,
      "default": 0.5
    }
  ]
}
