{
  "about": {
    "author_name": "xurei",
    "author_url": "http://about.xurei.io"
  },
  "metafileVersion": 1,
  "label": "Displace",
  "parameters": [
    {
      "name": "color_space",
      "label": "Color Space",
      "type": "list_int",
      "values": [
        {"label": "RGB", "value": 0},
        {"label": "YUV", "value": 1}
      ],
      "default": 1
    },
    {
      "name": "sampler_mode",
      "label": "Border method",
      "type": "list_int",
      "values": [
        {"label": "Clamp", "value": 0},
        {"label": "Mirror", "value": 1},
        {"label": "Repeat", "value": 2}
      ],
      "default": 0
    },
    {
      "name": "displacement_strength_x",
      "label": "Strength X",
      "type": "float",
      "slider": true,
      "min": 0,
      "max": 2.0,
      "default": 0.35,
      "step": 0.005
    },
    {
      "name": "displacement_strength_y",
      "label": "Strength Y",
      "type": "float",
      "slider": true,
      "min": 0,
      "max": 2.0,
      "default": 0.35,
      "step": 0.005
    }
  ]
}
