{
  "about": {
    "author_name": "xurei",
    "author_url": "http://about.xurei.io",
    "description": "Blur from one scene to another"
  },
  "metafileVersion": 1,
  "label": "Gaussian Blur",
  "steps": 3,
  "parameters": [
    {
      "name": "break_point",
      "label": "Breaking point",
      "type": "float",
      "slider": true,
      "min": 0,
      "max": 1,
      "step": 0.01,
      "default": 0.5
    },
    {
      "name": "max_blur_level",
      "label": "Blur level",
      "type": "float",
      "slider": true,
      "min": 0.1,
      "max": 10,
      "default": 5
    }
  ]
}
