{
  "about": {
    "author_name": "xurei",
    "author_url": "http://about.xurei.io"
  },
  "metafileVersion": 2,
  "label": "Vignette",
  "revision": 1,
  "steps": 1,
  "parameters": [
    {
      "name": "keep_aspect_ratio",
      "label": "Preserve aspect ratio",
      "type": "bool",
      "default": false
    },
    {
      "name": "strength",
      "label": "Strength",
      "type": "float",
      "slider": true,
      "min": 0,
      "max": 1,
      "default": 0.8,
      "step": 0.01
    },
    {
      "name": "inner",
      "label": "Inner radius",
      "type": "float",
      "slider": true,
      "min": 0.0,
      "max": 2.0,
      "default": 0.5,
      "step": 0.01
    },
    {
      "name": "outer",
      "label": "Outer radius",
      "type": "float",
      "slider": true,
      "min": 0.0,
      "max": 2.0,
      "default": 0.95,
      "step": 0.01
    },
    {
      "name": "curvature",
      "label": "Curvature",
      "type": "float",
      "slider": true,
      "min": 0.10,
      "max": 1.0,
      "default": 0.75,
      "step": 0.01
    }
  ]
}
