{
  "about": {
    "author_name": "xurei",
    "author_url": "http://about.xurei.io"
  },
  "label": "[Face Detection] Distort",
  "steps": 1,
  "input_time": false,
  "input_facedetection": true,
  "parameters": [
    {
      "name": "screen_distortion",
      "label": "Screen Distortion",
      "type": "double",
      "slider": true,
      "min": 0,
      "max": 1.0,
      "default": 0.3,
      "step": 0.01
    }
  ]
}
