{
  "metafileVersion": 1,
  "about": {
    "author_name": "xurei",
    "author_url": "http://about.xurei.io"
  },
  "label": "Recursion",
  "revision": 1,
  "steps": 1,
  "parameters": [
    {
      "name": "prev_image",
      "type": "prev_frame",
      "step": 0
    },
    {
      "name": "prev_alpha",
      "label": "Prev frame alpha",
      "type": "float",
      "min": 0.0,
      "max": 1.0,
      "step": 0.001,
      "slider": true,
      "default": 0.999
    },
    {
      "name": "zoom",
      "label": "Zoom",
      "type": "float",
      "min": 0.0,
      "max": 1.0,
      "step": 0.001,
      "slider": true,
      "default": 0.005
    }
  ]
}
