{
  "about": {
    "author_name": "xurei",
    "author_url": "http://about.xurei.io"
  },
  "metafileVersion": 1,
  "label": "Frost Slide",
  "steps": 3,
  "parameters": [
    {
      "name": "angle",
      "label": "Angle",
      "type": "float",
      "slider": true,
      "min": 0,
      "max": 180,
      "default": 110
    },
    {
      "name": "frost_width",
      "label": "Frost band width",
      "type": "float",
      "slider": true,
      "min": 0,
      "max": 200,
      "default": 30
    },
    {
      "name": "direction",
      "label": "Direction",
      "type": "list_int",
      "values": [
        {"label": "Right to Left", "value": 2},
        {"label": "Left to Right", "value": 3}
      ],
      "default": 2
    },
    {
      "name": "max_blur_level",
      "label": "Blur level",
      "type": "float",
      "slider": true,
      "min": 0.1,
      "max": 10,
      "default": 5
    },
    {
      "name": "white_mask",
      "label": "White mask",
      "type": "float",
      "slider": true,
      "min": 0,
      "max": 1,
      "step": 0.01,
      "default": 0.2
    },
    {
      "name": "frost_strength",
      "label": "Frost strength",
      "type": "float",
      "slider": true,
      "min": 0,
      "max": 100,
      "step": 0.1,
      "default": 0.4
    }
  ]
}
