{
  "about": {
    "author_name": "xurei",
    "author_url": "http://about.xurei.io"
  },
  "label": "Ghost",
  "steps": 2,
  "parameters": [
    {
      "name": "ghost_strength",
      "label": "Strength",
      "type": "double",
      "slider": true,
      "min": 0,
      "max": 1,
      "default": 0.01,
      "step": 0.01
    },
    {
      "name": "prev_tex",
      "type": "prev_frame",
      "step": 0
    }
  ]
}
