{
  "about": {
    "author_name": "xurei",
    "author_url": "http://about.xurei.io",
    "description": "Pixelate scene and unpixelate to the other"
  },
  "metafileVersion": 1,
  "label": "Pixelate",
  "parameters": [
    {
      "name": "break_point",
      "label": "Breaking point",
      "type": "float",
      "slider": true,
      "min": 0.0,
      "max": 1.0,
      "step": 0.01,
      "default": 0.5
    },
    {
      "name": "max_pixelation_level",
      "label": "Max Pixelation level",
      "type": "float",
      "slider": true,
      "min": 0.1,
      "max": 10,
      "default": 5
    }
  ]
}
