{
  "about": {
    "author_name": "xurei",
    "author_url": "http://about.xurei.io"
  },
  "label": "[Face Detection] Zoom to face",
  "steps": 1,
  "input_time": false,
  "input_facedetection": true,
  "parameters": [
    {
      "name": "zoom_level",
      "label": "Zoom level",
      "description": "prout",
      "type": "double",
      "slider": true,
      "min": 0,
      "max": 3.0,
      "default": 0.9,
      "step": 0.001
    },
    {
      "name": "show_ref_points",
      "label": "Show ref. points (devmode)",
      "type": "bool",
      "devmode": true,
      "default": false
    },
    {
      "name": "preserve_aspect_ratio",
      "label": "Preserve aspect ratio",
      "type": "bool",
      "default": true
    }
  ]
}
