{
  "about": {
    "author_name": "xurei",
    "author_url": "http://about.xurei.io"
  },
  "label": "Gaussian Blur",
  "steps": 2,
  "parameters": [
    {
      "name": "blur_level_x",
      "label": "Blur level (X)",
      "type": "int",
      "slider": true,
      "min": 0,
      "max": 100,
      "default": 10
    },
    {
      "name": "blur_level_y",
      "label": "Blur level (Y)",
      "type": "int",
      "slider": true,
      "min": 0,
      "max": 100,
      "default": 10
    }
  ]
}
