{
  "about": {
    "author_name": "xurei",
    "author_url": "http://about.xurei.io"
  },
  "metafileVersion": 1,
  "label": "Burn",
  "revision": 2,
  "steps": 1,
  "parameters": [
    {
      "name": "transition_point",
      "label": "Transition point",
      "type": "float",
      "slider": true,
      "min": 0.0,
      "max": 1.0,
      "step": 0.01,
      "default": 0.5
    },
    {
      "name": "random_noise",
      "label": "Random Noise",
      "type": "float",
      "slider": true,
      "min": 0.0,
      "max": 1.0,
      "step": 0.01,
      "default": 0.1
    }
  ]
}
